{
  "schema_version": "0.3.1",
  "audit_id": "fixture-composition-001",
  "generated_at": "2026-08-27T08:00:00Z",
  "candidate_ids": ["A", "B", "C"],
  "run_manifest": {
    "tool_version": "0.3.1",
    "config_hash": "sha256:36bb7e368e4466c9cc404644a69e694247eaba8af33570baf8cb6efa51ae045d",
    "cutoff": "2025-09-18",
    "domain": "computer science",
    "model_name": "host-agent-fixture",
    "prompt_version": "0.3.1",
    "retrieval_started_at": "2026-08-27T07:10:00Z",
    "retrieval_completed_at": "2026-08-27T07:18:00Z",
    "candidate_snapshot_hash": "sha256:b2fcbb781dd1bff5ce464b3e5df9739ed4a5f8a64417ab91e1a734a65b5edf90",
    "provider_endpoints": [
      {"name": "openalex", "endpoint": "https://api.openalex.org/works", "version": "2026-08"},
      {"name": "semantic-scholar", "endpoint": "https://api.semanticscholar.org/graph/v1", "version": "graph-v1"},
      {"name": "arxiv", "endpoint": "https://export.arxiv.org/api/query", "version": "atom"}
    ]
  },
  "input": {
    "claim": "We introduce an architecture with adaptive memory and compression-aware selection.",
    "normalized_claim": "architecture with adaptive memory and compression-aware selection",
    "field": "computer science",
    "cutoff": "2025-09-18",
    "strict_date": true
  },
  "author_bibliography": {
    "status": "PROVIDED",
    "source": "Normalized references supplied with the audited manuscript.",
    "entries": [{"raw_entry": "Compression-aware Selection (2023)", "matched_paper_id": "B", "match_basis": "TITLE_AUTHOR"}],
    "normalized_paper_ids": ["B"],
    "unmatched_entries": []
  },
  "claim_map": {
    "claim_id": "C0",
    "claim_text": "We introduce an architecture with adaptive memory and compression-aware selection.",
    "normalized_claim": "architecture with adaptive memory and compression-aware selection",
    "frozen_before_retrieval": true,
    "frozen_at": "2026-08-27T07:00:00Z",
    "freeze_hash": "sha256:234fd688583c704576bfaeddc6170c18d78403570d7f2c3aefd4b577da6315cd",
    "facets": [
      {"id": "F1", "type": "mechanism", "text": "adaptive memory", "critical": true, "author_critical": true, "structural_critical": true, "criticality_dispute": false},
      {"id": "F2", "type": "interaction", "text": "compression-aware selection", "critical": true, "author_critical": true, "structural_critical": true, "criticality_dispute": false}
    ]
  },
  "verdict": {
    "classification": "STRONG_COMPOSITION_RISK",
    "novelty_risk": "HIGH",
    "search_coverage": "BROAD",
    "evidence_confidence": "STRONG",
    "decided_at": "2026-08-27T07:45:00Z",
    "main_concern": "Paper A and Paper B jointly cover both critical facets, and Paper C explicitly connects them.",
    "evidence_ids": ["E1", "E2", "E3"]
  },
  "papers": [
    {
      "id": "A", "title": "Adaptive Memory Systems", "providers": ["openalex", "arxiv"], "dates": [{"value": "2022-03-01", "source": "arxiv_v1"}], "earliest_public_date": "2022-03-01", "cutoff_status": "ELIGIBLE", "references": [], "found_by_query_ids": ["Q-literal", "Q-mechanism"],
      "coverage": {"F1": {"status": "EXACT", "evidence_ids": ["E1"]}, "F2": {"status": "NO", "evidence_ids": ["E4"]}}
    },
    {
      "id": "B", "title": "Compression-aware Selection", "providers": ["openalex", "semantic-scholar"], "dates": [{"value": "2023-04-02", "source": "publisher_online"}], "earliest_public_date": "2023-04-02", "cutoff_status": "ELIGIBLE", "references": ["A"], "found_by_query_ids": ["Q-literal", "Q-problem"],
      "coverage": {"F1": {"status": "PARTIAL", "evidence_ids": ["E5"]}, "F2": {"status": "FUNCTIONAL", "evidence_ids": ["E2"]}}
    },
    {
      "id": "C", "title": "A Synthesis of Memory and Compression", "providers": ["openalex"], "dates": [{"value": "2024-05-03", "source": "publisher_online"}], "earliest_public_date": "2024-05-03", "cutoff_status": "ELIGIBLE", "references": ["A", "B"], "found_by_query_ids": ["Q-bridge"], "coverage": {}
    }
  ],
  "fulltext_acquisitions": [
    {"id": "FT:A:fixture", "paper_id": "A", "status": "COMPLETE", "source_url": "https://example.org/a.pdf", "source_kind": "PDF", "retrieved_at": "2026-08-27T07:20:00Z", "content_sha256": "sha256:aaaaaaaaaaaaaaaaaaaaaaaaaaaaaaaaaaaaaaaaaaaaaaaaaaaaaaaaaaaaaaaa", "text_sha256": "sha256:1111111111111111111111111111111111111111111111111111111111111111", "text_path": "run/fulltext/A.txt", "extraction_method": "pypdf", "char_count": 1200},
    {"id": "FT:B:fixture", "paper_id": "B", "status": "COMPLETE", "source_url": "https://example.org/b.html", "source_kind": "HTML", "retrieved_at": "2026-08-27T07:21:00Z", "content_sha256": "sha256:bbbbbbbbbbbbbbbbbbbbbbbbbbbbbbbbbbbbbbbbbbbbbbbbbbbbbbbbbbbbbbbb", "text_sha256": "sha256:2222222222222222222222222222222222222222222222222222222222222222", "text_path": "run/fulltext/B.txt", "extraction_method": "html.parser", "char_count": 900},
    {"id": "FT:C:fixture", "paper_id": "C", "status": "COMPLETE", "source_url": "https://example.org/c.txt", "source_kind": "TEXT", "retrieved_at": "2026-08-27T07:22:00Z", "content_sha256": "sha256:cccccccccccccccccccccccccccccccccccccccccccccccccccccccccccccccc", "text_sha256": "sha256:3333333333333333333333333333333333333333333333333333333333333333", "text_path": "run/fulltext/C.txt", "extraction_method": "utf-8", "char_count": 800}
  ],
  "evidence": [
    {"id": "E1", "canonical_paper_id": "A", "source_level": "TIER_2_FULLTEXT", "acquisition_id": "FT:A:fixture", "span": "We update a persistent memory state adaptively.", "location": "Method 3.1", "source": "https://example.org/a", "retrieved_at": "2026-08-27T07:30:00Z", "evidence_kind": "METHOD", "supports": ["F1"]},
    {"id": "E2", "canonical_paper_id": "B", "source_level": "TIER_2_FULLTEXT", "acquisition_id": "FT:B:fixture", "span": "Selection is conditioned on the compression ratio.", "location": "Method 4", "source": "https://example.org/b", "retrieved_at": "2026-08-27T07:31:00Z", "evidence_kind": "METHOD", "supports": ["F2"]},
    {"id": "E3", "canonical_paper_id": "C", "source_level": "TIER_2_FULLTEXT", "acquisition_id": "FT:C:fixture", "span": "Adaptive-memory methods such as A and compression-aware selection methods such as B belong to a shared efficiency design space.", "location": "Survey taxonomy, Section 2", "source": "https://example.org/c", "retrieved_at": "2026-08-27T07:32:00Z", "evidence_kind": "BRIDGE_TEXT"},
    {"id": "E4", "canonical_paper_id": "A", "source_level": "TIER_2_FULLTEXT", "acquisition_id": "FT:A:fixture", "span": "Inputs are not compressed.", "location": "Limitations", "source": "https://example.org/a", "retrieved_at": "2026-08-27T07:30:00Z", "evidence_kind": "METHOD", "supports": ["F2"]},
    {"id": "E5", "canonical_paper_id": "B", "source_level": "TIER_2_FULLTEXT", "acquisition_id": "FT:B:fixture", "span": "The retained state is fixed after initialization.", "location": "Method 4", "source": "https://example.org/b", "retrieved_at": "2026-08-27T07:31:00Z", "evidence_kind": "METHOD", "supports": ["F1"]}
  ],
  "top_killers": [
    {"paper_id": "A", "covers": ["F1"], "does_not_cover": ["F2"], "evidence_ids": ["E1", "E4"], "bibliography_status": "NOT_IN_BIBLIOGRAPHY"},
    {"paper_id": "B", "covers": ["F2"], "does_not_cover": ["F1"], "evidence_ids": ["E2", "E5"], "bibliography_status": "IN_BIBLIOGRAPHY"}
  ],
  "minimal_prior_sets": [
    {"paper_ids": ["A", "B"], "size": 2, "covered_facets": ["F1", "F2"], "coverage_by_paper": {"A": ["F1"], "B": ["F2"]}, "evidence_ids": ["E1", "E2"]}
  ],
  "bridges": [
    {"type": "TAXONOMY_BRIDGE", "provenance_type": "text", "paper_ids": ["A", "B"], "source_paper_id": "C", "cutoff_status": "ELIGIBLE", "text_verified": true, "source_rechecked_as_candidate": true, "evidence_ids": ["E3"]}
  ],
  "landscape_bridges": [],
  "criticality_sensitivity": [
    {"removed_facet": "F1", "baseline_size": 2, "alternative_size": 1, "alternative_classification": "DIRECT_PRECEDENT"},
    {"removed_facet": "F2", "baseline_size": 2, "alternative_size": 1, "alternative_classification": "DIRECT_PRECEDENT"}
  ],
  "ancestor_terms": [],
  "residual_novelty": "The exact interaction rule may survive if it differs from the bridge source.",
  "defensible_rewrite": {
    "text": "Prior work separately covers adaptive memory and compression-aware selection; we introduce a specific interaction rule between them.",
    "prior_coverage_claims": [
      {"text": "Prior work covers adaptive memory.", "evidence_ids": ["E1"]},
      {"text": "Prior work covers compression-aware selection.", "evidence_ids": ["E2"]}
    ]
  },
  "search": {
    "providers": [{"name": "openalex", "status": "ok"}, {"name": "semantic-scholar", "status": "ok"}, {"name": "arxiv", "status": "ok"}],
    "query_families": ["literal", "mechanism", "problem_function", "ancestor", "composition_bridge"],
    "query_runs": [
      {"query_id": "Q-literal", "provider": "openalex", "family": "literal", "query": "adaptive memory compression-aware selection", "reason": "Test the literal contribution wording.", "target_facets": ["F1", "F2"], "removed_author_terms": false, "retrieved_at": "2026-08-27T07:10:00Z", "temporal_recall_backstop": false, "provider_cutoff_applied": true, "returned_count": 2, "total_count": 2, "truncated": false, "pagination": {"page": 1, "per_page": 25, "next_cursor": null}, "corpus": "all", "saturation_stop_reason": "PROVIDER_EXHAUSTED", "paper_ids": ["A", "B"], "canonical_paper_ids": ["A", "B"], "status": "ok"},